[
  {
    "name": "Matteo Downtown",
    "suburb": "Sydney",
    "address": "20 Bond Street, Sydney NSW 2000",
    "lat": -33.8643522,
    "lng": 151.2084952,
    "website": "https://matteosydney.com/functions/bottomless-lunch",
    "cuisine": "Italian",
    "packages": [
      {
        "name": "Standard",
        "price": 99.0,
        "duration": 120,
        "days": [
          "Friday",
          "Saturday",
          "Sunday"
        ],
        "sessions": [
          "12:00"
        ],
        "description": "Italian banquet with bottomless beverage package; includes spritz on arrival and 2 hours of unlimited drinks from midday."
      },
      {
        "name": "Alcohol-Free",
        "price": 89.0,
        "duration": 120,
        "days": [
          "Friday",
          "Saturday",
          "Sunday"
        ],
        "sessions": [
          "12:00"
        ],
        "description": "Italian banquet bottomless lunch with two-hour non-alcoholic beverage package."
      }
    ]
  },
  {
    "name": "Bar Nina",
    "suburb": "Darlinghurst",
    "address": "85a Stanley Street, Darlinghurst NSW 2010",
    "lat": -33.8761513,
    "lng": 151.2176827,
    "website": "https://barnina.au/bottomless-menus-everyday",
    "instagram": "https://www.instagram.com/barninadarlo/",
    "cuisine": "Italian/Cafe",
    "packages": [
      {
        "name": "Brunch",
        "price": 59.0,
        "duration": 105,
        "days": [
          "Monday",
          "Tuesday",
          "Wednesday",
          "Thursday",
          "Friday",
          "Saturday",
          "Sunday"
        ],
        "sessions": [
          "09:00"
        ],
        "description": "Morning bottomless brunch with shared menu and unlimited mimosas, espresso martinis, house wines and beers for 105 minutes."
      },
      {
        "name": "Lunch",
        "price": 89.0,
        "duration": 105,
        "days": [
          "Monday",
          "Tuesday",
          "Wednesday",
          "Thursday",
          "Friday",
          "Saturday",
          "Sunday"
        ],
        "sessions": [
          "12:00"
        ],
        "description": "Bottomless lunch and dinner package with free-flowing mimosas, wines, beers and shared Italian dishes for 105 minutes."
      }
    ]
  },
  {
    "name": "Wild Sage Barangaroo",
    "suburb": "Barangaroo",
    "address": "Exchange Place, 3 Sussex Street, Barangaroo NSW 2000",
    "lat": -33.8647776,
    "lng": 151.2028639,
    "website": "https://wildsage.com.au/bottomless-lunch/",
    "instagram": "https://www.instagram.com/wildsagebarangaroo/",
    "cuisine": "Modern Aus/Mediterranean",
    "packages": [
      {
        "name": "Standard",
        "price": 79.0,
        "duration": 90,
        "days": [
          "Monday",
          "Tuesday",
          "Wednesday",
          "Thursday",
          "Friday",
          "Saturday",
          "Sunday"
        ],
        "sessions": [
          "12:00",
          "13:30"
        ],
        "description": "Daily bottomless brunch with shared menu and 90 minutes of free-flowing Aperol Spritz, Bellini and sparkling wine."
      },
      {
        "name": "Margarita",
        "price": 99.0,
        "duration": 90,
        "days": [
          "Friday",
          "Saturday",
          "Sunday",
          "Monday"
        ],
        "sessions": [
          "12:00",
          "13:30"
        ],
        "description": "Upgraded bottomless brunch with classic margaritas plus Aperol Spritz and shared menu for 90 minutes."
      }
    ]
  },
  {
    "name": "Cabana Bar",
    "suburb": "Sydney",
    "address": "25 Martin Place, Sydney NSW 2000",
    "lat": -33.8684078,
    "lng": 151.2092427,
    "website": "https://cabanabarsyd.com.au/bottomless-brunch/",
    "cuisine": "Mexican/Cocktail",
    "instagram": "https://www.instagram.com/cabanabarsyd/",
    "packages": [
      {
        "name": "",
        "price": 89.0,
        "duration": 120,
        "days": [
          "Saturday"
        ],
        "sessions": [
          "12:30",
          "14:30"
        ],
        "description": "Saturday-only bottomless brunch with margaritas, seasonal cocktails and Latin-inspired dishes for two hours."
      }
    ]
  },
  {
    "name": "The Winery",
    "suburb": "Surry Hills",
    "address": "285a Crown Street, Surry Hills NSW 2010",
    "lat": -33.8814624,
    "lng": 151.214579,
    "website": "https://thewinery.sydney/bellini-disco-brunch/",
    "cuisine": "Modern Australian",
    "instagram": "https://www.instagram.com/thewinerysurryhills/",
    "packages": [
      {
        "name": "",
        "price": 99.0,
        "duration": 120,
        "days": [
          "Saturday"
        ],
        "sessions": [
          "11:30",
          "12:00",
          "15:00"
        ],
        "description": "Bellini Disco Brunch on Saturdays with shared courses, Bellini cocktails and two-hour seating."
      }
    ]
  },
  {
    "name": "Darling Pavilion",
    "suburb": "Sydney",
    "address": "1 Harbour Street, Sydney NSW 2000",
    "lat": -33.872194,
    "lng": 151.2022642,
    "website": "https://darlingpavilion.com.au/",
    "cuisine": "Modern Australian",
    "packages": [
      {
        "name": "",
        "price": 89.0,
        "duration": 120,
        "days": [
          "Saturday",
          "Sunday"
        ],
        "sessions": [
          "12:00"
        ],
        "description": "Bottomless brunch with margarita on arrival and shared dishes; includes two-hour drink package of sparkling wine or beer."
      }
    ]
  },
  {
    "name": "Lil Darlin Surry Hills",
    "suburb": "Surry Hills",
    "address": "420 Elizabeth Street, Surry Hills NSW 2010",
    "lat": -33.886716,
    "lng": 151.2083554,
    "website": "https://lildarlin.com.au/",
    "cuisine": "Tapas/Italian",
    "packages": [
      {
        "name": "",
        "price": 89.0,
        "duration": 90,
        "days": [
          "Tuesday",
          "Wednesday",
          "Thursday",
          "Friday",
          "Saturday"
        ],
        "sessions": [
          "12:00",
          "13:00",
          "14:30"
        ],
        "description": "Shared tapas menu and bottomless drinks for 1.5 hours, available Tuesday to Saturday with multiple sittings."
      }
    ]
  },
  {
    "name": "Lil Darlin Crows Nest",
    "suburb": "Crows Nest",
    "address": "23 Willoughby Road, Crows Nest NSW 2065",
    "lat": -33.8270448,
    "lng": 151.2012214,
    "website": "https://lildarlin.com.au/",
    "cuisine": "Tapas/Italian",
    "packages": [
      {
        "name": "",
        "price": 89.0,
        "duration": 90,
        "days": [
          "Tuesday",
          "Wednesday",
          "Thursday",
          "Friday",
          "Saturday",
          "Sunday"
        ],
        "sessions": [
          "12:00",
          "13:00",
          "14:30"
        ],
        "description": "Bottomless brunch with pizza and tapas, bottomless cocktails and wine for 1.5 hours; available Tuesdayâ€“Sunday."
      }
    ]
  },
  {
    "name": "Cauliflower Hotel",
    "suburb": "Waterloo",
    "address": "123 Botany Road, Waterloo NSW 2017",
    "lat": -33.8988751,
    "lng": 151.2002163,
    "website": "https://www.thecauliflowerhotel.com.au/",
    "cuisine": "Mexican",
    "packages": [
      {
        "name": "",
        "price": 89.0,
        "duration": 90,
        "days": [
          "Saturday",
          "Sunday"
        ],
        "sessions": [
          "12:00"
        ],
        "description": "Weekend Mexican feast featuring unlimited margaritas, beer and wine with tacos and churros for 1.5 hours."
      }
    ]
  },
  {
    "name": "Oxford House Pool Bar",
    "suburb": "Paddington",
    "address": "21 Oxford Street, Paddington NSW 2021",
    "lat": -33.8828157,
    "lng": 151.2202451,
    "website": "https://oxfordhouse.com.au/pool-bar/bottomless-brunch/",
    "cuisine": "Modern Australian",
    "instagram": "https://www.instagram.com/oxfordhousesydney/",
    "packages": [
      {
        "name": "",
        "price": 99.0,
        "duration": 120,
        "days": [
          "Saturday"
        ],
        "sessions": [
          "12:00"
        ],
        "description": "Saturday poolside bottomless brunch at OH! Pool Bar with two hours of beverages and seasonal dishes."
      }
    ]
  },
  {
    "name": "Gitano Sydney",
    "suburb": "Double Bay",
    "address": "Shop 2/53 Cross Street, Double Bay NSW 2028",
    "lat": -33.8758808,
    "lng": 151.242289,
    "website": "https://www.gitano.com.au/",
    "cuisine": "Mexican",
    "instagram": "https://www.instagram.com/gitanosydney/",
    "packages": [
      {
        "name": "",
        "price": 99.0,
        "duration": 90,
        "days": [
          "Saturday",
          "Sunday"
        ],
        "sessions": [
          "12:00"
        ],
        "description": "1.5-hour bottomless brunch with Mexican-inspired dishes and unlimited drinks at Double Bay rooftop bar."
      }
    ]
  },
  {
    "name": "Royal Hotel Paddington",
    "suburb": "Paddington",
    "address": "237 Glenmore Road, Paddington NSW 2021",
    "lat": 0.0,
    "lng": 0.0,
    "website": "https://royalhotel.com.au/",
    "instagram": "https://www.instagram.com/royalhotelpaddo/",
    "cuisine": "Modern Australian",
    "packages": [
      {
        "name": "Standard",
        "price": 95.0,
        "duration": 120,
        "days": [
          "Saturday",
          "Sunday"
        ],
        "sessions": [
          "11:00"
        ],
        "description": "Banquet-style bottomless brunch with cocktails, craft beer and wines; two-hour sessions with optional extra hour."
      },
      {
        "name": "Long Lunch",
        "price": 95.0,
        "duration": 120,
        "days": [
          "Monday",
          "Tuesday",
          "Wednesday",
          "Thursday",
          "Friday",
          "Saturday",
          "Sunday"
        ],
        "sessions": [
          "12:00"
        ],